<!ELEMENT partido (equipo+)>
<!ELEMENT equipo (goles, posesion, tarjetas)>
<!ELEMENT goles (#PCDATA)>
<!ELEMENT posesion (#PCDATA)>
<!ELEMENT tarjetas (#PCDATA)>
<!ATTLIST partido id ID #REQUIRED>
<!ATTLIST equipo 
    estadia (local|visitante) #IMPLIED
    nombre CDATA #REQUIRED>